{"schemaVersion":"1.0","sessionId":"advisory-session","taskContractId":"advisory-task","ledgerTraceId":"advisory-trace","generatedAt":"1970-01-01T00:00:00.0000000Z","sourceDigest":"e2c5ce12fddc2cb8227ab211c217fe3083fcd0ce4f9a37332f808a5e5df816ae","classification":"recovery-after-failed-attempt","recommendation":"continue","obligations":[{"obligationId":"o1","status":"satisfied","classification":"progress","stable":true,"evidenceEventIds":["gate-out-1"]},{"obligationId":"o2","status":"regressed","classification":"recovery-after-failed-attempt","stable":false,"evidenceEventIds":["gate-out-2"]}]}
