{"schemaVersion":"1.0","sessionId":"advisory-session","taskContractId":"advisory-task","ledgerTraceId":"advisory-trace","generatedAt":"1970-01-01T00:00:00.0000000Z","sourceDigest":"e281342a77c1b94ae7c7539205052ecf6825c1c122f5d4060ac21cf0b8196a42","classification":"insufficient-evidence","recommendation":"insufficient-evidence","obligations":[{"obligationId":"o1","status":"satisfied","classification":"progress","stable":true,"evidenceEventIds":["gate-out-1"]},{"obligationId":"o2","status":"open","classification":"insufficient-evidence","stable":false,"evidenceEventIds":[]}]}
