{"schemaVersion":"1.0","sessionId":"advisory-session","taskContractId":"advisory-task","ledgerTraceId":"advisory-trace","generatedAt":"1970-01-01T00:00:00.0000000Z","sourceDigest":"f5ad97be0cedf8a3ea1a85305f22d907af057a5183fa42943f95f21173f368d7","classification":"progress","recommendation":"stop-recommended","obligations":[{"obligationId":"o1","status":"satisfied","classification":"progress","stable":true,"evidenceEventIds":["gate-out-1"]},{"obligationId":"o2","status":"satisfied","classification":"progress","stable":true,"evidenceEventIds":["gate-out-2"]}]}
